{
  "version": 1,
  "name": "graphite",
  "themes": [
    "dark"
  ],
  "dark": {
    "base": "#242424",
    "gradient": {
      "from": "#242424",
      "via": "#242424",
      "to": "#242424",
      "angle": 178
    },
    "strong": "#f7f5f1",
    "text": "#ddd9d3",
    "dim": "#bcb6ad",
    "faint": "#bcb6ad",
    "rule": "rgba(255,255,255,0.16)",
    "accent": "#e2b873",
    "blockFill": "rgba(255,255,255,0.025)",
    "warn": "#e0a856",
    "ok": "#78be96",
    "code": {
      "fill": "#171717",
      "text": "#e0dcd4",
      "keyword": "#e2b873",
      "comment": "#a19b92"
    },
    "ruleStrong": "rgba(255,255,255,0.24)",
    "wash": "rgba(255,255,255,0.045)",
    "dimSoft": "rgba(255,255,255,0.35)"
  },
  "gradient": {
    "shape": "flat",
    "texture": "none"
  },
  "layout": "normal",
  "fonts": {
    "heading": {
      "source": "bundled",
      "family": "Guide Sans",
      "size": 23
    },
    "body": {
      "source": "bundled",
      "family": "Guide Sans",
      "size": 10.2
    },
    "code": {
      "source": "bundled",
      "family": "DejaVu Sans Mono",
      "size": 7.5
    }
  }
}
